{
  "schema": "provenancecode.risk@1.0",
  "ra_id": "RA-000003",
  "repo": {
    "org": "provenancecode",
    "name": "provenancecode-cli"
  },
  "ref": "pc://provenancecode/provenancecode-cli/risk/RA-000003",
  "title": "Uncaught JSON parse errors in show/done commands expose raw Node.js stack traces",
  "status": "closed",
  "created_at": "2026-06-24T10:56:00Z",
  "updated_at": "2026-06-30T17:00:00Z",
  "risk_statement": "The tapShow, tapDone, actShow, meoShow, specShow, and mistakeShow command handlers called fs.readJsonSync() without try/catch. A malformed or adversarially crafted artifact JSON file would cause an unhandled SyntaxError or TypeError to surface as a raw Node.js stack trace, potentially revealing internal file paths, dependency versions, and call stack structure to an observer of CLI output.",
  "severity": "medium",
  "likelihood": "low",
  "scope": {
    "paths": ["src/commands/runtime.ts", "src/commands/artifact.ts"],
    "components": ["json-parsing", "error-handling"]
  },
  "acceptance": {
    "accepted_by": "kierandesmond",
    "accepted_at": "2026-06-24T10:56:00Z",
    "expires_at": "2027-06-24T00:00:00Z",
    "reason": "Risk mitigated in v2.2.0: all 6 show/done handlers wrap fs.readJsonSync() in try/catch and display a user-friendly error message instead of a stack trace."
  },
  "mitigations": [
    {
      "type": "error-handling",
      "detail": "All 6 affected handlers (tapShow, tapDone, actShow, meoShow, specShow, mistakeShow) wrap fs.readJsonSync() in try/catch. On parse failure, process exits with code 1 and prints a user-friendly message: '❌ Could not parse {id}: file may be corrupted'."
    }
  ],
  "links": {
    "decisions": [],
    "specs": [],
    "mistakes": []
  }
}
